{
  "schema_version": "nutriomics-document-evidence-handover-v1",
  "recorded_utc": "2026-10-11T02:30:07Z",
  "scope": {
    "purpose": "Finite source-backed augmentation of existing 94-page review; not an AI adjudication/import packet",
    "environment": "Mac execution environment unavailable; GitHub and Library read access verified",
    "local_report_modified": false,
    "api_files_modified": false,
    "main_modified": false,
    "api_application_status": "not_applied",
    "api_owner_thread_id": "01a109e2-7d7f-7756-b0e5-0d022dc6f00f",
    "submission_ready": false,
    "new_training": false,
    "new_cohort": false,
    "new_bulk_download": false,
    "new_schedule": false,
    "new_credentials": false
  },
  "provenance": {
    "analysis_engine": {
      "repository": "kangk1204/nutriomics-evidence-engine",
      "branch": "main",
      "commit": "7733ea43d063e9760f5dd372c8177d20eb74ff8e",
      "main_comparison": "identical at read",
      "graph_receipt_path": "docs/graph_allrow_20261003_v3.json",
      "graph_blob_sha1": "b06cc3dcafcbdf75a52a2d8b2ba7b88142fd7786",
      "graph_frozen_utc": "2026-10-03T03:06:05.542066+00:00"
    },
    "private_db": {
      "repository": "kangk1204/NutriOmics_DB_c",
      "branch": "main",
      "commit": "9ca37db477b34ca8a54f986b006c69424dedb81e",
      "main_comparison": "identical at read",
      "relationship": "separate Django harness; not merged into research engine"
    },
    "panel": {
      "library_file_id": "libfile_9da423931d988191b9c84fe7c9e71f14",
      "filename": "디어젠_2026_최종보고서_강근수_비만메틸화_유전자해석본_20261003.pdf",
      "pages": [
        48,
        49,
        50,
        51,
        52
      ],
      "annotation_basis": "native GPL13534 hg19/build37 labels as printed; fresh HGNC alias validation not performed"
    },
    "food_inventory": {
      "path": "docs/food_compound_extension_20261003_v1/extension_receipt.json",
      "blob_sha1": "5e904ea38ce868d3f524c7b0791420fd9963e3a7",
      "frozen_utc": "2026-10-03T07:40:51.487100+00:00",
      "source_version": "September2022 historical author-provided FooDB snapshot; not claimed as current2026 FooDB",
      "database_sha256": "5c32800b4906c0614e5fc51df44bf9cbef54f12dd24c45318f055dc41313d5e8"
    },
    "instructions": {
      "remote_root_AGENTS": "404 in both verified repositories; not an assertion that all local instructions are absent",
      "local_AGENTS_and_agents_skills": "inaccessible while Mac disconnected"
    }
  },
  "denominators": {
    "panel_cpgs": 50,
    "panel_native_annotated_cpgs": 39,
    "panel_native_gene_labels": 22,
    "panel_unassigned_cpgs": 11,
    "panel_replication_observed_cpgs": 46,
    "available_graph_receipt_traces": 6,
    "reviewed_receipt_traces": 6,
    "trace_unique_foods": 1,
    "trace_unique_compounds": 1,
    "trace_unique_composition_measurements": 1,
    "trace_unique_gene_symbols": 5,
    "trace_unique_compound_gene_edges": 5,
    "trace_panel_native_gene_overlap": 0,
    "qualified_whole_food_clinical_chains_in_reviewed_traces": 0,
    "food_inventory_structures": 4630,
    "food_inventory_positive_numeric_linked_structures": 2563,
    "food_inventory_qualitative_only_structures": 2067,
    "food_inventory_measured_occurrence_rows": 337004,
    "food_inventory_qualitative_occurrence_rows": 8620,
    "food_inventory_total_occurrence_rows": 345624,
    "current_4630_compound_to_actual_panel_linked_count": null,
    "current_4630_compound_to_actual_panel_unverified_count": null,
    "current_4630_link_audit_status": "not_computed; actual serving tables unavailable; six engine examples are a separate selected graph receipt, not a random sample or denominator of extension",
    "private_db_RC6_qualified_chains_recorded": 0,
    "private_db_RC6_replicated_chains_recorded": 0,
    "private_db_RC6_verified_independent_benchmark_cases_recorded": 0,
    "private_db_RC6_status_basis": "pinned README; frozen recorded state; no gate rerun",
    "evidence_records": 11,
    "evidence_records_are_independent_studies": false
  },
  "panel_rows": [
    {
      "cpg": "cg05593715",
      "annotation": "미배정",
      "chromosome": "8",
      "hg19_position": 95056896,
      "model_coefficient": 0.904,
      "delta_beta_discovery_pp": 4.82,
      "delta_beta_replication_pp": 2.36,
      "selected_folds": 9,
      "selection_denominator": 15
    },
    {
      "cpg": "cg21094739",
      "annotation": "ACE / Body",
      "chromosome": "17",
      "hg19_position": 61572645,
      "model_coefficient": 0.586,
      "delta_beta_discovery_pp": 3.51,
      "delta_beta_replication_pp": 3.32,
      "selected_folds": 7,
      "selection_denominator": 15
    },
    {
      "cpg": "cg12105450",
      "annotation": "CASP10 / 5'UTR",
      "chromosome": "2",
      "hg19_position": 202048100,
      "model_coefficient": -0.454,
      "delta_beta_discovery_pp": -8.62,
      "delta_beta_replication_pp": -7.57,
      "selected_folds": 9,
      "selection_denominator": 15
    },
    {
      "cpg": "cg19015897",
      "annotation": "TMEM100 / Body",
      "chromosome": "17",
      "hg19_position": 53798372,
      "model_coefficient": 0.397,
      "delta_beta_discovery_pp": 10.17,
      "delta_beta_replication_pp": 8.47,
      "selected_folds": 9,
      "selection_denominator": 15
    },
    {
      "cpg": "cg00096418",
      "annotation": "미배정",
      "chromosome": "16",
      "hg19_position": 65910068,
      "model_coefficient": 0.391,
      "delta_beta_discovery_pp": 8.16,
      "delta_beta_replication_pp": 9.54,
      "selected_folds": 11,
      "selection_denominator": 15
    },
    {
      "cpg": "cg07588401",
      "annotation": "미배정",
      "chromosome": "8",
      "hg19_position": 125951124,
      "model_coefficient": 0.374,
      "delta_beta_discovery_pp": 6.96,
      "delta_beta_replication_pp": 3.42,
      "selected_folds": 10,
      "selection_denominator": 15
    },
    {
      "cpg": "cg05210501",
      "annotation": "HOXA10 / 1stExon;5'UTR",
      "chromosome": "7",
      "hg19_position": 27219344,
      "model_coefficient": 0.369,
      "delta_beta_discovery_pp": 6.89,
      "delta_beta_replication_pp": 4.31,
      "selected_folds": 9,
      "selection_denominator": 15
    },
    {
      "cpg": "cg08125291",
      "annotation": "미배정",
      "chromosome": "13",
      "hg19_position": 44588186,
      "model_coefficient": 0.351,
      "delta_beta_discovery_pp": 8.95,
      "delta_beta_replication_pp": 4.51,
      "selected_folds": 10,
      "selection_denominator": 15
    },
    {
      "cpg": "cg12874792",
      "annotation": "RAD51L1 / Body",
      "chromosome": "14",
      "hg19_position": 68831098,
      "model_coefficient": 0.282,
      "delta_beta_discovery_pp": 8.22,
      "delta_beta_replication_pp": 6.29,
      "selected_folds": 9,
      "selection_denominator": 15
    },
    {
      "cpg": "cg00970558",
      "annotation": "CLEC4GP1 / Body",
      "chromosome": "19",
      "hg19_position": 7854469,
      "model_coefficient": 0.275,
      "delta_beta_discovery_pp": 8.6,
      "delta_beta_replication_pp": 5.21,
      "selected_folds": 14,
      "selection_denominator": 15
    },
    {
      "cpg": "cg14431443",
      "annotation": "TBX5 / TSS200",
      "chromosome": "12",
      "hg19_position": 114846431,
      "model_coefficient": -0.27,
      "delta_beta_discovery_pp": -8.87,
      "delta_beta_replication_pp": -6.78,
      "selected_folds": 13,
      "selection_denominator": 15
    },
    {
      "cpg": "cg06374384",
      "annotation": "P4HA3 / 3'UTR",
      "chromosome": "11",
      "hg19_position": 73978091,
      "model_coefficient": 0.253,
      "delta_beta_discovery_pp": 6.31,
      "delta_beta_replication_pp": 3.55,
      "selected_folds": 11,
      "selection_denominator": 15
    },
    {
      "cpg": "cg14375937",
      "annotation": "CYP26C1 / Body",
      "chromosome": "10",
      "hg19_position": 94825667,
      "model_coefficient": 0.241,
      "delta_beta_discovery_pp": 7.72,
      "delta_beta_replication_pp": 13.54,
      "selected_folds": 8,
      "selection_denominator": 15
    },
    {
      "cpg": "cg13100600",
      "annotation": "AGRN / Body",
      "chromosome": "1",
      "hg19_position": 958351,
      "model_coefficient": -0.236,
      "delta_beta_discovery_pp": -7.87,
      "delta_beta_replication_pp": -6.56,
      "selected_folds": 9,
      "selection_denominator": 15
    },
    {
      "cpg": "cg20895669",
      "annotation": "MCF2L / TSS1500",
      "chromosome": "13",
      "hg19_position": 113622539,
      "model_coefficient": -0.228,
      "delta_beta_discovery_pp": -7.62,
      "delta_beta_replication_pp": -5.15,
      "selected_folds": 10,
      "selection_denominator": 15
    },
    {
      "cpg": "cg10330839",
      "annotation": "LTBP4 / Body",
      "chromosome": "19",
      "hg19_position": 41115766,
      "model_coefficient": -0.227,
      "delta_beta_discovery_pp": -6.45,
      "delta_beta_replication_pp": null,
      "selected_folds": 10,
      "selection_denominator": 15
    },
    {
      "cpg": "cg06013060",
      "annotation": "미배정",
      "chromosome": "10",
      "hg19_position": 131813094,
      "model_coefficient": 0.186,
      "delta_beta_discovery_pp": 10.01,
      "delta_beta_replication_pp": 8.19,
      "selected_folds": 13,
      "selection_denominator": 15
    },
    {
      "cpg": "cg26757472",
      "annotation": "미배정",
      "chromosome": "16",
      "hg19_position": 86387131,
      "model_coefficient": -0.164,
      "delta_beta_discovery_pp": -5.99,
      "delta_beta_replication_pp": -5.81,
      "selected_folds": 15,
      "selection_denominator": 15
    },
    {
      "cpg": "cg11219400",
      "annotation": "TRANK1 / Body",
      "chromosome": "3",
      "hg19_position": 36949966,
      "model_coefficient": -0.136,
      "delta_beta_discovery_pp": -10.49,
      "delta_beta_replication_pp": -7.21,
      "selected_folds": 12,
      "selection_denominator": 15
    },
    {
      "cpg": "cg15255827",